{
  "schema_id": "load_series",
  "schema_version": "1.0",
  "artifact_type": "load_series",
  "created_utc": "2026-03-29T12:00:00Z",
  "unit": "N",
  "sample_rate_hz": 50,
  "sensor": {
    "type": "strain_gauge",
    "capacity_N": 500.0,
    "resolution_N": 0.1,
    "calibration_date": "2026-01-15"
  },
  "data": [
    [0.0, 0.1],
    [0.02, 0.15],
    [0.04, 0.22],
    [0.06, 0.28],
    [0.08, 0.35],
    [0.1, 0.42]
  ],
  "statistics": {
    "min": 0.1,
    "max": 0.42,
    "mean": 0.26,
    "std": 0.11,
    "n_samples": 6
  }
}
